{
  "_notice": "Synthetic request context with exact public issuer/JWK metadata; contains no secrets or PII.",
  "health": {
    "status": 200,
    "headers": { "content-type": "application/json" },
    "body": { "status": "ok" }
  },
  "ready": {
    "status": 200,
    "headers": { "content-type": "application/json" },
    "body": { "status": "ok" }
  },
  "openidConfiguration": {
    "status": 200,
    "headers": { "cache-control": "public, max-age=300" },
    "body": {
      "issuer": "https://auth.financenow.kr",
      "jwks_uri": "https://auth.financenow.kr/.well-known/jwks.json",
      "subject_types_supported": ["public"],
      "response_types_supported": ["code"]
    }
  },
  "jwks": {
    "status": 200,
    "headers": { "cache-control": "public, max-age=300" },
    "body": {
      "keys": [{ "kty": "RSA", "use": "sig", "alg": "RS256", "kid": "auth-79d0a7ecc677e242", "n": "m1EdQ6TFW6Ph9Wn5QhsQtxIGRHF9zeDT1QUUgvmDvViCMd3ZhtWJ-B-WQwFUdXCPzWQmSn-1CyyV3SntiGBmKXIPQIU3XJs4CzZNwtMeD1Z-H0EOcETa0FWYtirK3e_vyxKxM8iSYFRoAXjZAW1dCazm6tRUjsQ3WQHrhsAsFqQqpyiVKY_ZP-hBLMFrkALkpG7KUaGWt9gjtM96pstfaOFUZNgZ-sc6Mal2ZF7yXogmhCmMbPeWgYJ8T9uC7SLJS4IpqpHfLCMQTKtXyIaJBXrLaCnm9yLtQbWVSZVKUdkY3Fr1y4qRg-CnSCOIjhruvdu6H7acJfvRYvqMKJUmhw", "e": "AQAB" }]
    }
  },
  "notFound": {
    "status": 404,
    "headers": { "content-type": "application/json" },
    "body": { "error": { "code": "NOT_FOUND", "message": "Route not found" } }
  }
}
